{
  "schema_version": "1.0",
  "id": "hnd_01J8ZQ4M7T2V9K3NXW5R6YHBCJ",
  "session": {
    "id": "ses_01J8ZQ4M7T2V9K3NXW5R6YHBCD",
    "runtime": "claude",
    "native_id": "3f6c1a2e-9d4b-4c8a-b1f0-7e5d2c9a8b17"
  },
  "repository_id": null,
  "created_at": "2026-09-17T16:00:00Z",
  "created_by": {
    "type": "user",
    "id": "patrick"
  },
  "recipient": "alex",
  "body_markdown": "## Objective\nFinish the outbox drain.\n",
  "governance_state": {
    "water_mark": "internal",
    "tags": [
      {
        "key": "data-class",
        "value": "internal"
      }
    ]
  },
  "anchors_scope": "sender-local",
  "content_hash": "sha256:aaaaaaaaaaaaaaaaaaaaaaaaaaaaaaaaaaaaaaaaaaaaaaaaaaaaaaaaaaaaaaaa"
}
